{
  "session_id": "LS-20260129-001",
  "learning_goal": "学习渲染知识，shader编写，在cocos creator实践渲染优化",
  "profile_id": "profile-1738161600000",
  "knowledge_points": [
    {
      "id": "KP-1",
      "title": "GPU渲染管线基础",
      "description": "理解现代GPU渲染管线的核心概念：顶点处理、图元装配、光栅化、片段着色、输出合并。了解渲染管线各阶段的作用和数据流向。",
      "prerequisites": [],
      "topic_refs": ["rendering-pipeline", "gpu-basics"],
      "phase": 1,
      "resources": [
        {
          "type": "documentation",
          "url": "https://docs.cocos.com/creator/3.8/manual/zh/render-pipeline/write-render-pipeline.html",
          "summary": "Cocos Creator官方渲染管线文档，介绍如何编写和理解渲染管线",
          "quality": "gold",
          "quality_score": 0.95
        },
        {
          "type": "tutorial",
          "url": "https://learnopengl-cn.github.io/01%20Getting%20started/04%20Hello%20Triangle/",
          "summary": "LearnOpenGL中文版-渲染管线基础讲解",
          "quality": "gold",
          "quality_score": 0.9
        }
      ],
      "assessment": {
        "type": "multiple_choice",
        "description": "能够清晰描述GPU渲染管线的各个阶段及其作用",
        "acceptance_criteria": [
          "能说出渲染管线的5个主要阶段",
          "理解顶点着色器和片段着色器的职责",
          "了解光栅化的作用"
        ]
      },
      "estimated_effort": "medium",
      "status": "pending"
    },
    {
      "id": "KP-2",
      "title": "GLSL基础语法",
      "description": "学习GLSL着色器语言的基础语法：数据类型(vec2/vec3/vec4/mat4)、内置函数、uniform/attribute/varying变量、纹理采样。",
      "prerequisites": ["KP-1"],
      "topic_refs": ["glsl", "shader-language"],
      "phase": 1,
      "resources": [
        {
          "type": "documentation",
          "url": "https://docs.cocos.com/creator/3.8/manual/en/shader/glsl.html",
          "summary": "Cocos Creator GLSL语法官方文档，介绍GLSL基础数据类型和语法",
          "quality": "gold",
          "quality_score": 0.95
        },
        {
          "type": "documentation",
          "url": "https://docs.cocos.com/creator/3.8/manual/zh/shader/effect-syntax.html",
          "summary": "Cocos Effect着色器语法详解",
          "quality": "gold",
          "quality_score": 0.92
        },
        {
          "type": "interactive",
          "url": "https://thebookofshaders.com/",
          "summary": "The Book of Shaders - 交互式GLSL学习网站",
          "quality": "gold",
          "quality_score": 0.9
        }
      ],
      "assessment": {
        "type": "practical_task",
        "description": "编写一个简单的片段着色器，实现颜色渐变效果",
        "acceptance_criteria": [
          "正确使用vec4定义颜色",
          "使用mix函数实现颜色插值",
          "理解uv坐标的含义"
        ]
      },
      "estimated_effort": "medium",
      "status": "pending"
    },
    {
      "id": "KP-3",
      "title": "Cocos Effect文件结构",
      "description": "掌握Cocos Creator特有的Effect文件格式：CCEffect YAML声明、CCProgram着色器代码块、techniques/passes配置、properties属性定义。",
      "prerequisites": ["KP-2"],
      "topic_refs": ["cocos-effect", "shader-framework"],
      "phase": 2,
      "resources": [
        {
          "type": "documentation",
          "url": "https://docs.cocos.com/creator/3.8/manual/en/shader/effect-syntax.html",
          "summary": "Cocos Shader语法官方文档 - 完整的Effect文件结构说明",
          "quality": "gold",
          "quality_score": 0.98
        },
        {
          "type": "documentation",
          "url": "https://docs.cocos.com/creator/3.8/manual/en/shader/write-effect-overview.html",
          "summary": "自定义Effect概述 - 如何创建和组织Effect文件",
          "quality": "gold",
          "quality_score": 0.92
        }
      ],
      "assessment": {
        "type": "practical_task",
        "description": "创建一个完整的Cocos Effect文件，包含基本的顶点和片段着色器",
        "acceptance_criteria": [
          "正确的CCEffect YAML结构",
          "定义至少一个technique和pass",
          "使用properties暴露可调参数"
        ]
      },
      "estimated_effort": "medium",
      "status": "pending"
    },
    {
      "id": "KP-4",
      "title": "2D Sprite着色器实战",
      "description": "学习Cocos Creator内置的2D Sprite着色器结构，实现常见的2D效果：灰度、渐变、溶解、描边等。",
      "prerequisites": ["KP-3"],
      "topic_refs": ["2d-shader", "sprite-effect"],
      "phase": 2,
      "resources": [
        {
          "type": "documentation",
          "url": "https://docs.cocos.com/creator/3.8/manual/en/shader/write-effect-2d-sprite-gradient.html",
          "summary": "官方2D Sprite渐变效果教程 - 完整的Shader代码示例",
          "quality": "gold",
          "quality_score": 0.95
        },
        {
          "type": "tutorial",
          "url": "https://codeinterstellar.medium.com/creating-dynamic-filter-effect-in-cocos-creator-a-three-mode-shader-guide-e29b32fab5a9",
          "summary": "Cocos Creator动态滤镜效果 - 三模式Shader指南(灰度/反色/正常)",
          "quality": "silver",
          "quality_score": 0.75
        }
      ],
      "assessment": {
        "type": "practical_task",
        "description": "实现一个2D Sprite溶解效果Shader",
        "acceptance_criteria": [
          "使用噪声纹理控制溶解",
          "支持溶解进度参数调节",
          "边缘有颜色过渡效果"
        ]
      },
      "estimated_effort": "hard",
      "status": "pending"
    },
    {
      "id": "KP-5",
      "title": "Surface Shader架构",
      "description": "学习Cocos Creator 3.7+的Surface Shader架构：表面材质数据、光照模型、PBR材质参数。理解Surface Shader与传统Shader的区别。",
      "prerequisites": ["KP-3"],
      "topic_refs": ["surface-shader", "pbr"],
      "phase": 2,
      "resources": [
        {
          "type": "documentation",
          "url": "https://docs.cocos.com/creator/3.8/manual/en/shader/surface-shader/builtin-surface-shader.html",
          "summary": "内置Surface Shader指南 - 详细的架构和使用说明",
          "quality": "gold",
          "quality_score": 0.95
        },
        {
          "type": "documentation",
          "url": "https://docs.cocos.com/creator/3.8/manual/en/shader/surface-shader/shader-code-flow.html",
          "summary": "Surface Shader执行流程 - GBuffer输出和着色器代码组织",
          "quality": "gold",
          "quality_score": 0.9
        },
        {
          "type": "documentation",
          "url": "https://docs.cocos.com/creator/3.8/manual/en/shader/surface-shader/customize-surface-shader.html",
          "summary": "自定义Surface Shader - 修改光照结果和材质数据",
          "quality": "gold",
          "quality_score": 0.88
        }
      ],
      "assessment": {
        "type": "practical_task",
        "description": "基于Surface Shader创建一个自定义材质效果",
        "acceptance_criteria": [
          "理解SurfacesMaterialData结构",
          "能够修改光照计算结果",
          "实现自定义的材质表现"
        ]
      },
      "estimated_effort": "hard",
      "status": "pending"
    },
    {
      "id": "KP-6",
      "title": "DrawCall与批处理优化",
      "description": "深入理解DrawCall概念、批处理原理、动态合批/静态合批条件、图集使用最佳实践。",
      "prerequisites": ["KP-1"],
      "topic_refs": ["drawcall", "batching", "rendering-optimization"],
      "phase": 3,
      "resources": [
        {
          "type": "documentation",
          "url": "https://docs.cocos.com/creator/3.8/manual/zh/ui-system/components/engine/ui-batch.html",
          "summary": "Cocos UI批处理文档 - 官方批处理机制说明",
          "quality": "gold",
          "quality_score": 0.9
        },
        {
          "type": "tutorial",
          "url": "https://forum.cocos.org/t/cocos-creator-drawcall/95677",
          "summary": "Cocos论坛DrawCall优化专题讨论",
          "quality": "silver",
          "quality_score": 0.7
        }
      ],
      "assessment": {
        "type": "practical_task",
        "description": "对一个UI场景进行DrawCall优化",
        "acceptance_criteria": [
          "使用图集减少DrawCall",
          "正确配置批处理条件",
          "DrawCall数量减少50%以上"
        ]
      },
      "estimated_effort": "medium",
      "status": "pending"
    },
    {
      "id": "KP-7",
      "title": "纹理压缩与内存优化",
      "description": "学习不同平台的纹理压缩格式(ASTC/ETC2/PVRTC)、mipmap使用、纹理尺寸优化策略。",
      "prerequisites": ["KP-6"],
      "topic_refs": ["texture-compression", "memory-optimization"],
      "phase": 3,
      "resources": [
        {
          "type": "documentation",
          "url": "https://docs.cocos.com/creator/3.8/manual/zh/asset/compress-texture.html",
          "summary": "Cocos纹理压缩官方文档 - 各平台格式支持和配置",
          "quality": "gold",
          "quality_score": 0.92
        },
        {
          "type": "documentation",
          "url": "https://docs.cocos.com/creator/3.8/manual/zh/asset/texture.html",
          "summary": "纹理资源文档 - 纹理参数和优化设置",
          "quality": "gold",
          "quality_score": 0.88
        }
      ],
      "assessment": {
        "type": "practical_task",
        "description": "为一个项目配置多平台纹理压缩方案",
        "acceptance_criteria": [
          "iOS使用ASTC格式",
          "Android使用ETC2格式",
          "验证内存占用减少"
        ]
      },
      "estimated_effort": "medium",
      "status": "pending"
    },
    {
      "id": "KP-8",
      "title": "后处理效果",
      "description": "学习Cocos Creator后处理管线：Bloom、色调映射、抗锯齿、景深等效果的原理和使用。",
      "prerequisites": ["KP-5"],
      "topic_refs": ["post-processing", "render-pipeline"],
      "phase": 3,
      "resources": [
        {
          "type": "documentation",
          "url": "https://docs.cocos.com/creator/3.8/manual/zh/render-pipeline/use-post-process.html",
          "summary": "使用后处理效果官方文档 - 完整的后处理配置指南",
          "quality": "gold",
          "quality_score": 0.93
        },
        {
          "type": "documentation",
          "url": "https://docs.cocos.com/creator/3.8/manual/zh/render-pipeline/write-render-pipeline.html",
          "summary": "编写渲染管线 - 自定义后处理Pass",
          "quality": "gold",
          "quality_score": 0.88
        }
      ],
      "assessment": {
        "type": "practical_task",
        "description": "为3D场景添加Bloom和色调映射后处理",
        "acceptance_criteria": [
          "正确配置后处理Volume",
          "实现Bloom发光效果",
          "理解HDR和色调映射关系"
        ]
      },
      "estimated_effort": "hard",
      "status": "pending"
    },
    {
      "id": "KP-9",
      "title": "光照与阴影优化",
      "description": "掌握Cocos Creator的光照系统：光源类型、阴影贴图、级联阴影(CSM)、光照烘焙基础。",
      "prerequisites": ["KP-5", "KP-6"],
      "topic_refs": ["lighting", "shadow", "optimization"],
      "phase": 3,
      "resources": [
        {